asin,rating,title,text,verified_purchase,label
B0000ANEZU,4,,the sony sdms73 is a very good monitor for the price i purchased a lower cost 17 lcd and was very disappointed as its display was not clear and had 2 dead pixels it went directly to ebay i purchased this monitor as a replacement for use with my mac ibookwhen i connected the sony my first impression was dismay and a feeling of de ja vu was this another bad product silver items in the mac os x aqua interface safari and the mail client in particular were tinted an ugly shade of pink ugh this product was almost returnedfortunately i ran the display color calibration and was able to correct all problems the default sony sdm73 profile appears to be off at least on my ibook with the version of mac os 103 that i am running run the display color calibration tool in expert mode and this is a good monitor for use with macs it may take 23 attempts to get it exactly right but the result is well worth the efforta note to those epecting perfection quality is not as good as apples lcd cinema displays do not expect the same clarity and quality as apples higher end cinema displays but given the price differential this is to be expected apple doesnt offer 17 lcd displays at presenti love the sony,False,2005-01-28 16:22:21.000,Price
B00021N27A,5,,for the price this portable cd player has excellent sound quality and extra features to make it perfect for outdoor sports or light jogging and walking the antishock protection feature really works and the backband headphones are comfortable to wear and seem to stay in place fairly wellthe cd player has a grip band accessory that also works for attaching this cd player to any belt loop i like the compact design and the simplicity of the features you can buy an ac adaptor for home usethe real beauty of this cd player is that you can use the program play feature to play up to 32 tracks in any order you wish this is a good feature if you want to listen to just a few tracks on any specific cd the program deletes itself when you turn off the unit you can also use the random play featurethe rebecca review,False,2005-03-12 09:01:33.000,portability
B00069IQG0,4,,i own a treo 650 and tried a plantronics bluetooth headset which was a awful experience bad comfort and bad sound quality i bought the logitech and have found it to have great sound for both incoming and outgoing it has 20ft range and the wind resistance works well if it was a little more comfortable after wearing for the long periods of time i would have given it a rating of 5,True,2005-03-27 06:39:36.000,Bad Performance
B0007LW2ZI,2,,i have an old olympus 21 megapixel c2100 it had a built in stabilization just like this minolta z5 unfortunately the builtin stabilizer option is about the only plus i can find for this minoltamy pictures that i take using my 21 megapixel olympus are night and day more vibrant in color than the ones taken with the minoltawe are returning this camera to get our money back we were excited about the stabilization feature as it is a hard feature to find in a camera but if it sacrifices picture quality then it is not worth it,False,2005-05-23 16:06:20.000,Bad Performance
B0002OZXHO,4,great product but do not expect apple to help you after you have purchased it,i just wanted to warn people of this before they are stuck in the same position i am inapple charges you for their phone support even if your product is within warranty after 90 days from the purchase date this is a big rip off you spend hundreds of dollars and within 4 months have to spend more just to have a little help with your productipods are great they saved my computer i am not denying this i just hate that apple can get away with ripping their customers off like thisbasically even if you are covered by warranty you had better hope nothing goes wrong after 3 months because they will not help you if it does,False,2005-07-11 21:57:15.000,charging
B00006HOKW,5,,this tripod is heavy duty allows for easy adjustments in many directions holds your tripod at a variety of angles is light and folds easily my only regret is not buying the 15 bag available seperately from amazon at the same time but ill get that with my next amazon order,False,2005-08-09 11:54:11.000,durability
B00062WV86,5,,i searched for a week to find the best price and ended up back where i started you cant beat this price if you want a 2gb card if you have a digital slr or a high megapixel digital camera you need lots of storage room i was once on vacation with a 512mb card and ran out of space because i forgot to offload to my laptop one night dont let that happen to you at this price who can afford not to have the storage space that you need when the perfect shot that peacock spreading its feathers your daughters first steps the look of suprise as you hand someone a gift etc comes around,True,2005-08-09 11:56:04.000,storage
B00009V3HV,4,,this is a great filter to improve your outdoor pictures the only problem is that the nikon lens cap that fits on my 1870mm lens wont fit on with this filter in place i was buying this not for improving pictures but to protect my lense but if the cap wont fit then im not going to bother using it on a day to day basis keep that in mind it does improve your pictures and i will certainly use it for landscape shots and nature photography but for daytoday use when im pulling the lens cap on and off it isnt worth the trouble,False,2005-08-09 11:59:28.000,Size
B0002EMY9Y,4,,i bought this for use with my coolpix 5000 camera because nikons tech support had recomended it they said it would improve my indoor shots because the cp 5000 has a terrible flash builtin but instead it overloads the shots and they come out mostly white i read the manual carefully and it looks like the reason is that this flash is built to automatically or manually focus the light for a 14mm to 70mm lense and the cp 5000 has a 72mm lense i subsequently purchased a nikon d70s camera 1000000 times better camera and this flash is great for extremely dark shots on that camera though the builtin flash is perfect for fill so this is really only for night shots and shots in darkness where i want to get something far away if you own a coolpix camera consider buying a used flash that isnt as powerfull if you own a d70s and want superior night photography this is the best flash in the world good thing i ended up in the latter end of the spectrum,True,2005-08-09 12:07:35.000,Bad Performance
B0009JPRE6,5,,the other reviews and the description seem to properly describe this camera i am writing this review to give you the perspective of someone who started out with film slr cameras in school then got a digital 5mp camera and have used that for years and am now finally getting into digital slr photography this is a big step back into the professional circle for me and im anxious to get out to the zoo or to some vacation spot in the mountains to do my professional photography once again i purchased this camera almost a month ago and my opinion is that it is the best camera ever made under 2000 this camera has everything you can needi want to warn you get the full set with the lense this lense sells for almost 400 and is about the best all around lense you can find dont go for the cheap models i wrote a list about this camera that may appear on this page for you to look at but be sure that you get the mll3 wireless remote for 20 how can you go wrong and a spare battery 2000 pictures sounds like a lot and i havent needed to recharge in this month that ive had the camera but remember that when you go on a trip you may forget to recharge and you dont want to get stuck also get a tripod try the slik tripods u9000 i wrote a review of it and i find it to be the best buy around for a lightweight tripod that acts like a much heavier one and get a carrying case the jury is still out i havent found one that i like i want one that will hold two cameras 4 lenses a large flash and a bunch of accessoriesif you arent sure if the d70s is worth the money over the d50 or the d70 it is the improved autofocusing system is much better than the others and the larger lcd is worth all the tea in china i leave the lcd protector that came with it on and have no problem seeing my pictures even outside although this is a larger camera than the d50 it isnt much of a difference and you will regret going with the cheaper cameraif your budget was lower save up and buy this camera i bought a coolpix 5000 a few years back and always kicked myself for not going with the d100 now ive gone with the best camera on the market and im perfectly happy plus i have the satisfaction of knowing that none of my friends can show me a better camera unless they spent 4000 or more on a d2x or d2h and none of my friends can afford to do that,False,2005-08-09 12:49:20.000,ease of use
B0006Q7FFG,5,,these work as advertised they take crappy sounding bassless ipod stock earbuds and make them sound at 100 better mainly more bass dont get me wrong your not going to get audiophile quality here just much better i had to bump up the mid to highs via the eq on my ipod to even things out for the price it was well worth it the little carry case they give you is darn handy also,True,2005-08-12 03:04:07.000,portability
B00021MX1Q,5,,i needed a small system for my office i wanted removable speakers good sound at all volumes and a sleek look this system filled that void i searched for about a month to get it and there is nothing less than fantastic about this system even the pricein terms of sound i can understand music at all volume levels many cheaper systems distort at low levels and at high volumes it sounds great i cant use it at high volumes now that ive taken it to work but i am thinking about buying another for my living room at home run the output of my family room stereo and ill have a system that sounds good in both places for partiesin terms of looks this system is very cool i tried to downplay it by placing it behind my desk on the shelf where i keep my food so that people wouldnt question it because small stereos are allowed but not everyone likes us having them despite my attempts to blend it in ive received several complements on the way that it looks silver casing and a sleek design are just the basics this system features a blue backlit display that looks greati thought that the dvd option in the stereo meant that you could play mp3s on dvd a great idea for someone who wants to never have to change cds but in fact it meant that the system is a dvd player and it has a video output to connect to your tv thats a nice plus i havent tried the mp3 idea yet so it may or may not support themthe stock antenna is terrible but so are most stereo antennas ill buy a new one soon the other downside is that you cant switch between presets without the remote you can change the station but not using presets but with 30 fm presets ill never run out the only thing that wasnt obvious about the setup is that the disk buttons disk 1 disk 2 etc on the stereo are the eject buttons not the select buttons like most other stereos overall this is a great design for a great stereo i used to work at a radio station as the engineer and now i wish i had this back then because i could blast music in my office and really utilize the system the way it was meant to,True,2005-08-16 13:04:40.000,portability
B00067V1TG,5,,this is a great gadget and it really works a little arm swings up to accommodate the battery you place it between the two points and the easy to read display tells you instantly whether you have a dud or if you can eke out another few minutes of battery life best of all it can fit in your pocket so you take it anywhere you have battery operated equipmentone side of it handles aa aaa c and d batteries and on the other side there are two buttons for testing those pesky 9 volt batteries so youll have no more tingling tongues from the old fashioned tongue between the terminals checking methoddont expect any fancy packaging or even the same color as advertised mine is a dull yellow but if you have kids andor lots of battery operated gizmos and gadgets youll need one of these and at the price why notamanda richards august 17 2005,True,2005-08-18 03:14:56.000,portability
B00007E7JU,5,,good1 very cheap2 pretty fast lens even in low light light small3 excellent depth of field4 made in japanbadnothing actually except maybe it looks not as sturdy as its big brother 50mm f14 but hey it cost 4 timesmy advice buy this and get cheap uv haze to protect it from uv weather dust and scratch i got tiffen 52mm uv haze filter for 589 smart investment for my 70 lensits a must lens for everyone who has canon slr,False,2005-09-07 18:04:07.000,speed
B0002OD3JY,5,,after spending around six months scouring various digital camera reviews online and through magazines i finally decided on the canon powershot a95 5 megapixel camera as offering the perfect marriage of power and portability my first digital camera i bought it as a goingaway present for myself since i was spending the summer living and working in spain and knew that i needed a camera that could keep up with my travelsit was a snap to take out and set up and intuitive enough that a couple of cursory glances at the quick start guide had me well on my way to pointing and shooting the camera comes with a usb cable several software programs a 16 mb compact flash card of course youll want to invest in more memory as soon as possible with the highestresolution photos consider a 512 mb or larger card batteries and a wrist strapi would rate the camera as midsized it is not waferthin but neither is it absurdly bulky or heavy for most of my traveling around spain i simply slipped it into its bubble wrap and into a soft fabric bag where it fit comfortably in my purse the design is comfortable to shoot with over long periods and i found the layout of the buttons to be intuitive less is more there are few external buttons shutter onoff menu and related buttons and most controls are carried out through the onscreen menus the flipout lcd screen is one reason i decided on this canon over others in the powershot line it makes previewing photos a snap and can be swiveled 180 degreesthe photo quality i kept it on large superfine is astonishing clear sharp vibrant photos check out some of my uploaded photos using the canon a95 in truetolife tones with minute detailing there are various shooting modes including manual macro panoramic with stitch assist software nighttime slow shutter and more and a movie mode that captures brief jerky videos with tinny sound this isnt a camcorder so i wasnt surprised that video quality wasnt better since i bought this primarily for photosyou will also want to invest in a few basic accessories rechargeable nicad batteries and a rapid charger a sturdy case and a bigger memory card for starters although the included software is capable enough to get the job done consider upgrading to adobe photoshop elements around 90 or if youre a pro adobe photoshop cs 2 several hundred dollars an excellent first camera with plenty of power and a reliable name,False,2005-09-11 13:14:50.000,portability
B0009N7OKW,5,,the mouse is not black like the picture instead its a shiny gray and its really a nice i have had several comments about its appearance and how it stands out from the rest the mouse is great and is very sensitive to touch so it responds quite well at high speeds i would definitely recommend this gadget to anyone who loves a quality goodlooking mouse with great battery life,False,2005-09-19 23:36:25.000,speed
B0001M2FYQ,4,,very nice sound better than the philips product of similar price however some deficiencies make it a bit disappointing 1 no digital volume control so you cant set volume level for an alarm and there is no progressively louder alarm 2 as someone else noted if you want 2 alarms at 2 different times eg 5am 6am they need to be on different music sources eg 5am radio 6am cdid still recommend it if the features dont make a big difference to you since the sound is good and everything works well,True,2005-10-09 14:17:37.000,charging
B0001H9L8O,4,,nothing fancy but a great choice if what you want is a good solid optical mouse without a wire good for younger hands i bought it for a 7year old boy,True,2005-10-09 14:23:06.000,ease of use
B0009B0IX4,4,,definitely a good buy especially as the price keeps dropping excellent sound i have it paired with a razr and it was fairly straightforward after i carefully reread and understood the instructions i wish they had made it easier to fold and put in a pocket and also that it shut off easily like some of the moto models also note that if you use the little foam tip for the mouthpiece it can fall off way too easily,True,2005-10-09 21:36:32.000,ease of use
B0007OWNC2,3,it does extend range if used with a rangemax router or wap but its not spectacular,yes it does work meaning if you get the rangemax router or wireless access point the pair of them do give you better range than for example a netgear wgt624 router with a wgt511 card and other such combos that ive tried its a bit erratic the signal level fluctuates which seems to me to be a software algorithm problem i hope they can improve it further but for now its meeting my needsa bit more detail i have a large house and the networking stuff is all at one end never mind why so at the other end of the house the wireless signal would fade to nothing with this rangemax combo i can now get an adequate signal 2 bars where i used to get nothingso dont expect too much but also dont be daunted by the bad reviews its worth a try as you know every building is different so as they say in another context your results may vary,True,2005-10-19 00:52:00.000,Signal
B00024ENES,5,,targus tcg417 17 citygear los angeles notebook caseas others have said this is a welldesigned and wellconstructed case it is great if you want to carry a 17in laptop some cds dvds a few books magazines etcgo for it if it meets your specs,True,2005-10-19 01:01:33.000,portability
B0007WIC1K,1,,i bought this camera after having one of the mavicas for several years thinking of course that sony has improved upon their features and design i was very very wrongthere are several things about this camera that make it seem cheap and quite returnable1 battery the batteries rechargeable aa type must be removed from the camera to be charged this is the most cumbersome task for the price of this camera2 lenses for any other lens you must use a large plastic ring that attaches not to the cameras lens but to the camera itself any type of wide angle lens ive tried several causes the edges of the socalled adapter to actually be in the photographs this is a very useless and cheap ploy by sony to make this camera versatle with the plastic ring and then with your desired lens it makes the camera look like a toy this is not my first sony it is quite an embarasing thing to see and use3 flash recharge the mavica never had this problem it takes about 710 seconds for the flash to recharge this is again a very embarassing thing about this camera to have your friends sit there and wait for that spontaneous snapshot kind of loses the moment when im watching the flash recharge indicator blinkblinkblink rediculous4 zoom you cant zoom in movie mode this is the dumbest thing about this camera you cant zoom in movie mode touted with such a great zoom and well nuff saidmy initial impression was that this camera would be a professional highquality sony product however due to the curious shortfalls of basic features i was very misslead by the hype over this camera there are other issues 50 of all photographs even in good light or on a tripod are out of focusand of course theres the classic sony snapshot delay those of you with sony cameras will know exactly what i mean youd think that after 78 years of this that they would fix that nope in fact on this camera its worse i cant tell you how many pictures of the ceiling or the floor or someones foot i have taken because of this dear sony fix this problemi feel sorry for sony over this camera it should be about 199 when you compare it to the features and design of competitor cameras glad i kept the boxps i just heard that the dscf828 their brand new 8mp camera was suddenly discontinued with no explaination perhaps they are finally rethinking or thinking about their design and usefulness,False,2005-11-02 16:47:19.000,Bad Performance
B0001GZ87I,3,,ltlttargus cvr400 15 citylite notebook casethis is very nice if what you want to carry with you is a 15in laptop powercord small mouse plus some paperwork theres no room for anything more its not really made for stuffing extra stuff even an extra paperback might be a bit too muchi find it just a bit too small for my use id have liked it to be a little bit fatter so i can carry some extra stuff like a book pill bottles and suchone criticism the strap is ok but not as comfortable as youd ideally want i found it handy to take the strap off my old lands end canvas briefcase and use that instead,True,2005-11-05 18:41:05.000,Size
B00007KDVI,3,,i bought this router after my belkin router died set up was very easy however a few internet sites would not load tmobile which is a problem because that is our cellular carrier and a couple more about half of the page would load and then nothing after contacting tech support not much help on this i upgraded the firmware nope still the same this seems to be the issue with version 5 of this router earlier versions seem to be fine according to the research i did i returned it and bought a dlink and so far so good i really liked this router but if i cant go where i want on the net then why own it,False,2005-11-28 04:02:14.000,Bad Performance
B0002GS4Y6,1,,this is the worst mouse ever while it feels great in your hand and i wish more mice had rubber on their body the functionality is horrid when you move the mouse it takes 1 to several seconds before the mousereceive wakes up this happens every time you stop moving the mouse not after a while of sittingi called their tech support all they would do is tell me to use newer and different batteries so i yelled at them and they sent me another set and it did the exact same thingi want a mouse that moves when i move my handwhats worse when the mouse actually does sit around for more than 30 seconds maybe a minute didnt time it but not long at all then it really goes to sleep and you cant make it move at all unless you click one of the buttons what sucks it sends the wakeup button click throughso if you left your mouse on buy now on a thousand shares of x to think about it and research it and decided not to buy it you are screwed you cant move the mouse off the button and clicking the button to wake mouse up will pass the click through and press on the button for you,False,2005-11-29 21:03:26.000,Bad Performance
B0000AFX1R,1,,this is the worst mouse ever while it feels great in your hand and i wish more mice had rubber on their body the functionality is horrid when you move the mouse it takes 1 to several seconds before the mousereceive wakes up this happens every time you stop moving the mouse not after a while of sittingi called their tech support all they would do is tell me to use newer and different batteries so i yelled at them and they sent me another set and it did the exact same thingi want a mouse that moves when i move my handwhats worse when the mouse actually does sit around for more than 30 seconds maybe a minute didnt time it but not long at all then it really goes to sleep and you cant make it move at all unless you click one of the buttons what sucks it sends the wakeup button click throughso if you left your mouse on buy now on a thousand shares of x to think about it and research it and decided not to buy it you are screwed you cant move the mouse off the button and clicking the button to wake mouse up will pass the click through and press on the button for you,False,2005-11-29 21:10:50.000,Bad Performance
